{
  "config": "ai_platform/configs/freqai-residual-pytorch-m1-generalization-v3-residual-mlp.example.json",
  "description": "Frozen M1ResidualPyTorchRegressor comparator on the bounded SOL/XRP M1 v3 generalization cohort.",
  "download_timerange": "1754006400-1777593599",
  "experiment_id": "residual-pytorch-m1-residual-mlp-generalization-v3",
  "fee": 0.002,
  "freqai_model": "M1ResidualPyTorchRegressor",
  "output_root": "ai_platform/artifacts/experimental-model-research/residual-pytorch-m1-generalization-v3/residual-mlp",
  "pairs": [
    "SOL/USDT",
    "XRP/USDT"
  ],
  "schema_version": 1,
  "strategy": "AiFrozenCandidateStrategyV2",
  "strategy_path": "ai_platform/strategies",
  "timeframes": [
    "15m",
    "1h",
    "4h"
  ],
  "timerange": "1772323200-1777593599"
}
