{
    "schema_version": 1,
    "experiment_id": "freqai-baseline-v1",
    "description": "Pinned research baseline for the initial LightGBM FreqAI strategy.",
    "config": "ai_platform/configs/freqai-baseline.example.json",
    "strategy": "AiBaselineStrategy",
    "strategy_path": "ai_platform/strategies",
    "freqai_model": "LightGBMRegressor",
    "timerange": "20260101-20260630",
    "download_timerange": "20250801-20260630",
    "pairs": [
        "BTC/USDT",
        "ETH/USDT"
    ],
    "timeframes": [
        "15m",
        "1h",
        "4h"
    ],
    "fee": 0.002,
    "output_root": "ai_platform/artifacts"
}
